{
  "schema_version": 1,
  "description": "Canonical claim and conflict ledger for consolidating the retained framework documents.",
  "status_vocabulary": {
    "established": "The statement follows from standard definitions or cited theorem-level evidence.",
    "corrected": "The source claim contains a repairable mathematical or terminological error; the canonical statement records the repair.",
    "bounded": "A narrower statement is supported within explicit assumptions or data limits.",
    "conjectural": "The statement is precise enough to test but has not passed its stated falsification gate.",
    "unsupported": "The statement lacks a defined mechanism, derivation, or discriminating evidence.",
    "falsified": "A stated or implemented version fails a reproducible counterexample or measurement.",
    "repaired": "A reproducible implementation defect was corrected and regression-tested.",
    "excluded": "The statement is too undefined or non-empirical to enter the scientific core."
  },
  "claims": [
    {
      "id": "octonion_normed_division_boundary",
      "domain": "nonassociative_algebra",
      "source_anchors": [
        {"document_id": "maximal-extraction-set1-set2", "source_line": 146},
        {"document_id": "math4genesisframework", "source_line": 310}
      ],
      "source_statement": "The Cayley-Dickson sequence supplies progressively higher-dimensional algebraic foundations.",
      "canonical_statement": "The real normed division algebras stop at the octonions. Further Cayley-Dickson doublings remain algebras but lose division, composition, and additional identities.",
      "status": "established",
      "confidence": "high",
      "evidence_source_ids": ["arxiv_baez_math_0105155", "arxiv_moreno_math_0512517"],
      "repo_evidence_paths": ["src/mathphysics/algebras/cayley_dickson.py", "experiments/results/cayley_dickson_real_validation.json", "data/registry/cayley_dickson_property_audit.json", "tests/unit/test_cayley_dickson_properties.py"],
      "falsification_test": "Construct a nonzero zero divisor in each claimed division algebra beyond dimension eight, or prove the asserted norm composition identity for all elements.",
      "integration_action": "Use dimensions 1, 2, 4, and 8 for division-algebra claims; require explicit weaker identities at every higher doubling."
    },
    {
      "id": "higher_cayley_dickson_physical_mapping",
      "domain": "mathematical_physics",
      "source_anchors": [
        {"document_id": "maximal-extraction-set1-set2", "source_line": 170},
        {"document_id": "maximal-extraction-set1-set2", "source_line": 734}
      ],
      "source_statement": "Sedenion zero divisors and higher Cayley-Dickson algebras represent physical defects, states, or force structures.",
      "canonical_statement": "Higher Cayley-Dickson algebras provide testable algebraic objects, but no retained derivation maps their zero divisors to a measured physical observable.",
      "status": "unsupported",
      "confidence": "high",
      "evidence_source_ids": ["arxiv_moreno_math_0512517", "arxiv_wilmot_2505_11747"],
      "repo_evidence_paths": ["research/fact_checks/mathematical_validation_report.txt"],
      "falsification_test": "Define a dimensional state map, derive an observable that changes under zero-divisor structure, and distinguish it from a matched algebra-free control.",
      "integration_action": "Keep the algebraic construction in the core and move physical interpretations to the open-hypothesis register."
    },
    {
      "id": "albert_exceptional_group_ladder",
      "domain": "jordan_algebra",
      "source_anchors": [
        {"document_id": "maximal-extraction-set1-set2", "source_line": 397},
        {"document_id": "maximal-extraction-set1-set2", "source_line": 398}
      ],
      "source_statement": "E6 is the automorphism group of J3(O), and E7 is the automorphism group of J3(S).",
      "canonical_statement": "For the Albert algebra J3(O), F4 is the automorphism group; suitable real or complex forms of E6 and E7 arise as structure and conformal groups. J3(S) is not an Albert algebra and cannot justify the stated E7 automorphism claim.",
      "status": "corrected",
      "confidence": "high",
      "evidence_source_ids": ["arxiv_baez_math_0105155"],
      "repo_evidence_paths": ["src/mathphysics/algebras/jordan.py", "data/registry/exceptional_group_scope_audit.json", "tests/unit/test_jordan_algebra.py", "research/fact_checks/Maximal_Extraction_Complete_Analysis.txt"],
      "falsification_test": "Verify each proposed group action preserves the relevant Jordan product or determinant and identify the exact group functor and real form.",
      "integration_action": "Replace the source ladder with an automorphism-structure-conformal table and remove J3(S)."
    },
    {
      "id": "spin8_triality",
      "domain": "lie_theory",
      "source_anchors": [
        {"document_id": "maximal-extraction-set1-set2", "source_line": 62}
      ],
      "source_statement": "Spin(8) triality permutes vector and two spinor representations.",
      "canonical_statement": "The outer automorphism group of Spin(8) permutes its vector and two inequivalent eight-dimensional spinor representations.",
      "status": "established",
      "confidence": "high",
      "evidence_source_ids": ["arxiv_baez_math_0105155"],
      "repo_evidence_paths": ["research/fact_checks/mathematical_validation_report.txt"],
      "falsification_test": "Construct the D4 Dynkin-diagram automorphisms and verify the induced permutation of the three representations.",
      "integration_action": "Retain as a mathematical foundation; do not extend triality to fractal or fluid systems without a defined representation."
    },
    {
      "id": "e9_e10_e11_classification",
      "domain": "kac_moody_algebra",
      "source_anchors": [
        {"document_id": "maximal-extraction-set1-set2", "source_line": 498}
      ],
      "source_statement": "E9, E10, and E11 are exceptional Lie algebras.",
      "canonical_statement": "E9 is the affine extension of E8, E10 is hyperbolic, and E11 is very extended; they are infinite-dimensional Kac-Moody algebras rather than additional finite-dimensional exceptional simple Lie algebras.",
      "status": "corrected",
      "confidence": "high",
      "evidence_source_ids": ["arxiv_damour_e10_0207267", "arxiv_west_e11_0104081"],
      "repo_evidence_paths": ["src/mathphysics/algebras/roots.py", "data/registry/exceptional_group_scope_audit.json", "tests/unit/test_roots.py", "research/kac_moody_deep_analysis.txt"],
      "falsification_test": "Derive the generalized Cartan matrices and classify them by affine, hyperbolic, and very-extended criteria.",
      "integration_action": "Normalize terminology throughout the framework and isolate proposed supergravity correspondences as conjectural."
    },
    {
      "id": "e10_e11_supergravity_scope",
      "domain": "quantum_gravity",
      "source_anchors": [
        {"document_id": "maximal-extraction-set1-set2", "source_line": 326}
      ],
      "source_statement": "E10 and E11 supply a general unifying physical symmetry.",
      "canonical_statement": "Specific truncated correspondences between E10 or E11 structures and supergravity variables motivate research programs; they do not establish a complete unifying symmetry of observed interactions.",
      "status": "bounded",
      "confidence": "high",
      "evidence_source_ids": ["arxiv_damour_e10_0207267", "arxiv_west_e11_0104081"],
      "repo_evidence_paths": ["research/kac_moody_deep_analysis.txt"],
      "falsification_test": "State the level truncation, dictionary, equations matched, and first unmatched term; reject any scope broader than the demonstrated correspondence.",
      "integration_action": "Present the established algebra first and the supergravity dictionary as a bounded conjectural application."
    },
    {
      "id": "monstrous_moonshine_stability",
      "domain": "modular_forms",
      "source_anchors": [
        {"document_id": "maximal-extraction-set1-set2", "source_line": 521},
        {"document_id": "math4genesisframework", "source_line": 201}
      ],
      "source_statement": "Monster Group modular invariants enforce stability in fractal and physical kernels.",
      "canonical_statement": "Monstrous moonshine relates specific modular functions to graded Monster representations. No retained operator maps that theorem to stability of a fractal, fluid, or physical evolution equation.",
      "status": "unsupported",
      "confidence": "high",
      "evidence_source_ids": ["borcherds_monstrous_moonshine_1992", "arxiv_duncan_griffin_ono_1411_6571"],
      "repo_evidence_paths": ["data/registry/exceptional_group_scope_audit.json", "papers/sections/review_mathematical_baseline.tex"],
      "falsification_test": "Define the Monster representation, modular object, state space, evolution operator, and a stability bound that fails under a matched non-moonshine control.",
      "integration_action": "Retain moonshine as mathematics and remove generic stability language from the scientific core."
    },
    {
      "id": "fractional_and_negative_dimension_scope",
      "domain": "fractal_geometry",
      "source_anchors": [
        {"document_id": "math4genesisframework", "source_line": 63},
        {"document_id": "math5genesisframeworkunveiled", "source_line": 108}
      ],
      "source_statement": "Fractional and negative dimensions behave as dynamical spatial dimensions.",
      "canonical_statement": "Hausdorff, box-counting, and generalized dimensions may be non-integer. Negative values arise in specialized multifractal or formal extensions and are not literal negative spatial axes.",
      "status": "corrected",
      "confidence": "high",
      "evidence_source_ids": [],
      "repo_evidence_paths": ["research/fact_checks/mathematical_validation_report.txt", "src/mathphysics/fractal_analysis.py"],